{
  "name": "Catppuccin Mocha",
  "slug": "catppuccin-mocha",
  "author": "Catppuccin / Codex Themes",
  "type": "app",
  "mode": "dark",
  "tags": ["dark", "pastel", "mocha"],
  "description": "Catppuccin Mocha adapted for Codex App with pastel accents and soft contrast.",
  "codeThemeId": "catppuccin-mocha",
  "theme": {
    "accent": "#89b4fa",
    "background": "#1e1e2e",
    "foreground": "#cdd6f4",
    "surface": "#313244",
    "contrast": 46,
    "fonts": {
      "ui": "SF Pro Text",
      "code": "SF Mono"
    }
  }
}
