{
  "name": "Dracula",
  "slug": "dracula",
  "author": "Dracula Theme / Codex Themes",
  "type": "app",
  "mode": "dark",
  "tags": ["dark", "purple", "neon"],
  "description": "Dracula adapted for Codex App with vivid purple accents and high contrast.",
  "codeThemeId": "dracula",
  "theme": {
    "accent": "#bd93f9",
    "background": "#282a36",
    "foreground": "#f8f8f2",
    "surface": "#44475a",
    "contrast": 55,
    "opaqueWindows": false,
    "semanticColors": {
      "diffAdded": "#50fa7b",
      "diffRemoved": "#ff5555",
      "skill": "#bd93f9"
    },
    "fonts": {
      "ui": "SF Pro Text",
      "code": "SF Mono"
    }
  }
}
